{
  "$schema": "./catalog.schema.json",
  "schemaVersion": 2,
  "catalogId": "milxdy-maintainer-catalog",
  "revision": "2026-08-06.1",
  "catalogStatus": "preview",
  "supportedBuildTargets": [
    "chromium"
  ],
  "buildRecipes": [
    {
      "id": "maintainer-local-v1",
      "target": "chromium",
      "prepareCommand": "npm run addons:prepare -- --selection=<file>",
      "applyCommand": "npm run addons:apply -- <acknowledgements>",
      "outputDirectory": "dist/chromium-local-apps/"
    }
  ],
  "sections": [
    {
      "id": "official",
      "name": "Official milXdy add-ons",
      "description": "The current reviewed package boundaries. Pets Maker is the first catalog-installed app; BOORU and Meme Maker remain Post-Factory capabilities, not separate add-ons.",
      "packages": [
        {
          "id": "pets-maker",
          "name": "Pets Maker",
          "icon": {
            "src": "assets/addons/pets-maker.svg",
            "alt": "Pets Maker character bundle"
          },
          "summary": "Prepare a validated local Remilia Maker avatar bundle for the Custom Pet pipeline.",
          "packageKind": "app",
          "version": "0.1.1-pilot",
          "sdk": {
            "minVersion": "0.2.4",
            "targetVersion": "0.2.4"
          },
          "availability": "published",
          "publisher": "milXdy maintainers",
          "source": {
            "repositoryUrl": "https://github.com/bonklek/milXdy",
            "path": "packages/maintainer/pets-maker",
            "issues": [
              "https://github.com/bonklek/milXdy/issues/181",
              "https://github.com/bonklek/milXdy/issues/190",
              "https://github.com/bonklek/milXdy/issues/191"
            ]
          },
          "artifact": {
            "kind": "maintainer-source",
            "path": "packages/maintainer/pets-maker",
            "packageSha256": "9e835e324bed1784bd184b4ac4e23f03734dd612832a9ac58103004243291b4f",
            "recipeId": "maintainer-local-v1"
          },
          "review": {
            "status": "approved",
            "reviewedBy": "milxdy-maintainer-pets-maker",
            "reviewedAt": "2026-08-03",
            "notes": [
              "Reviewed optional package moved from the local pilot into the pinned maintainer catalog source tree.",
              "Installation leaves the enablement setting false; the user must explicitly enable Pets Maker in Apps & Features.",
              "The 0.1.1 review covers the explicit public Maker metadata Fetch action; the selected image is never sent to that service."
            ]
          },
          "capabilities": [
            "Open a dedicated Pets Maker side-rail app only after explicit enablement and rail invocation.",
            "Read one transparent local Maker PNG selected in the visible file control.",
            "Collect exact Maker family, optional NFT number, trait IDs, lower-body, footwear, and palette choices.",
            "Fetch public Maker traits for an explicitly selected family and NFT number and place them in the visible form for review.",
            "Preview a deterministic 1024x1024 composite and download a validated two-file request ZIP."
          ],
          "permissions": {
            "hosts": [
              "https://maker.remilia.org/*"
            ],
            "optional": [],
            "privilegedSurfaces": [
              "X/Twitter App SDK side-rail overlay",
              "User-initiated local file input",
              "User-initiated public Maker metadata request",
              "User-initiated local ZIP download"
            ],
            "notes": [
              "The only added host permission is maker.remilia.org for the explicit Fetch action; the package has no background, browser-tab, clipboard, or raw runtime-messaging access.",
              "Composition requires explicit package-consent acknowledgement because local files and extension-origin package code are privileged inputs."
            ]
          },
          "siteScopes": [
            "X/Twitter side-rail overlay opened explicitly by the user",
            "Public Maker metadata requested only after an explicit Fetch"
          ],
          "remoteServices": [
            {
              "name": "Remilia Maker metadata",
              "origin": "https://maker.remilia.org",
              "purpose": "Populate visible Pets Maker trait fields after an explicit Fetch.",
              "dataSent": "Selected public Maker family and NFT number only; no image, account, cookie, or authentication data."
            }
          ],
          "storage": {
            "local": [
              "milxdy.local.pets-maker.enabled"
            ],
            "sync": [],
            "session": [],
            "notes": [
              "Stores only the disabled-by-default enablement toggle; form state and selected files are not persisted."
            ]
          },
          "privacyNotes": [
            "The selected PNG and body choices stay in the open app and generated local ZIP; the image is never uploaded.",
            "An explicit Fetch sends only the selected public Maker family and NFT number; returned traits populate the visible form and are not cached.",
            "Nothing is posted or published.",
            "Installing the package does not enable it, pin it to the rail, read a file, or generate a bundle."
          ],
          "dependencies": [],
          "conflicts": [],
          "replacement": null,
          "blockers": []
        },
        {
          "id": "tweet-composer-kit",
          "name": "Post-Factory",
          "icon": {
            "src": "assets/addons/tweet-composer.svg",
            "alt": "Post-Factory action panel"
          },
          "summary": "Composer actions, quick replies, Remibooru discovery, and reviewed maker handoffs in one package.",
          "packageKind": "app",
          "version": "0.2.0-pilot",
          "sdk": {
            "minVersion": "0.2.4",
            "targetVersion": "0.2.4"
          },
          "availability": "under-review",
          "publisher": "milXdy maintainers",
          "source": {
            "repositoryUrl": "https://github.com/bonklek/milXdy",
            "path": null,
            "issues": [
              "https://github.com/bonklek/milXdy/issues/17",
              "https://github.com/bonklek/milXdy/issues/25",
              "https://github.com/bonklek/milXdy/issues/79",
              "https://github.com/bonklek/milXdy/issues/188"
            ]
          },
          "artifact": null,
          "review": {
            "status": "in-progress",
            "notes": [
              "Post-Factory is active in cumulative QA as a locally reviewed package, but its maintainer source is not yet checked into an allowlisted catalog artifact path.",
              "It remains non-selectable until source, package hash, and trusted catalog review are committed together."
            ]
          },
          "capabilities": [
            "Open the host-owned native Drafts action from the composer.",
            "Manage local quick-reply phrases and explicitly select one for the host reply action.",
            "Browse reviewed Remibooru reaction metadata, explicitly attach a sanitized thumbnail to the initiating composer, or open its canonical source page.",
            "Open declared Milady, Remilio, Bonkler, and Kagami maker handoffs after explicit caption review.",
            "Open CHEESEWORLD as an ordinary explicit external link."
          ],
          "permissions": {
            "hosts": [
              "https://maker.remilia.org/*",
              "https://remibooru.com/*"
            ],
            "optional": [],
            "privilegedSurfaces": [
              "X/Twitter composer action panel",
              "X/Twitter reply actions",
              "Host-owned Remilia Maker handoff adapter",
              "Host-owned Remibooru query adapter",
              "Package-owned composer controls"
            ],
            "notes": [
              "The package has no raw browser messaging, tab, clipboard, or X DOM access.",
              "Remote services require explicit user actions and package-consent acknowledgement."
            ]
          },
          "siteScopes": [
            "X/Twitter composer and reply action surfaces only"
          ],
          "remoteServices": [
            {
              "name": "Remilia Maker",
              "origin": "https://maker.remilia.org",
              "purpose": "Open the explicitly selected maker with reviewed caption fields or random-meme mode.",
              "dataSent": "Only the user-reviewed Top text and Bottom text fields for the selected maker; no X account, cookie, authentication, or image data."
            },
            {
              "name": "Remibooru",
              "origin": "https://remibooru.com",
              "purpose": "Query public reaction-media posts and facets and open canonical source or native upload pages.",
              "dataSent": "Explicit public query facets, pagination cursor, and page-size limit only; no X account, draft, cookie, authentication, image, tag, or upload data."
            }
          ],
          "storage": {
            "local": [
              "milxdy.local.tweet-composer-kit.enabled",
              "milxdy.local.tweet-composer-kit.customPhrases"
            ],
            "sync": [],
            "session": [],
            "notes": [
              "Stores enablement and up to 20 local quick-reply phrases of at most 280 characters."
            ]
          },
          "privacyNotes": [
            "The package cannot inspect X drafts, maker pages, Remibooru pages, tabs, clipboard contents, or authentication state.",
            "Maker captions transfer only after an explicit package action; generated media remains user-reviewed and is never posted automatically.",